[{"pre_conc_storage_time": 1.0, "sample_location": "wwtp", "time_zone": "utc-07:00", "hum_frac_chem_unit": "micrograms/L wastewater", "test_result_date": "2021-04-30", "tot_conc_vol": 1.0, "sars_cov2_below_lod": "yes", "sample_id": "fdsaier8473619djfshf", "zipcode": "90745", "quant_stan_type": "dna", "collection_storage_time": 2.0, "pcr_target_ref": "www.example.com", "equiv_sewage_amt": 0.95820824, "pre_conc_storage_temp": 22.0, "rec_eff_spike_matrix": "raw sample", "industrial_input": 17.0, "sars_cov2_avg_conc": 1.2143245, "collection_storage_temp": 22.0, "other_norm_ref": "www.example.com", "inhibition_method": "www.example.com", "other_norm_unit": "copies/L wastewater", "hum_frac_target_chem_ref": "www.example.com", "other_jurisdiction": null, "sewage_travel_time": 9.9, "sars_cov2_cl_95_up": 2.0, "extraction_method": "qiagen allprep powerviral dna/rna kit", "collection_water_temp": 22.0, "lod_sewage": 100909.0, "pre_ext_storage_temp": -12.0, "county_names": "San Franscisco, Los Angeles", "other_norm_name": "pepper mild mottle virus", "epaid": "CA0042234", "hum_frac_chem_conc": 1.23, "lab_id": "RFDIE8AS-73619djfshf", "pre_ext_storage_time": 0.0, "hum_frac_target_chem": "caffeine", "hum_frac_mic_unit": "copies/L wastewater", "concentration_method": "membrane filtration with addition of mgcl2", "solids_separation": "filtration", "sample_collect_time": "23:58:00", "hum_frac_target_mic": "pepper mild mottle virus", "flow_rate": 1000.0, "sample_collect_date": "2021-04-28", "population_served": 3500000, "stan_ref": "www.example.com", "pasteurized": "yes", "conductivity": 0.0042, "institution_type": "ship", "pretreatment": "yes", "stormwater_input": "yes", "capacity_mgd": 160.0, "ph": 6.78, "sars_cov2_cl_95_lo": 1.0, "pcr_target": "n1", "tss": 23.44523, "num_no_target_control": "0", "sample_matrix": "raw wastewater", "other_norm_conc": 21.0, "quality_flag": "yes", "ext_blank": "yes", "rec_eff_percent": 23.0, "wwtp_name": "LACSD_Jnt", "reporting_jurisdiction": "CA", "sars_cov2_units": "copies/L wastewater", "sars_cov2_std_error": null, "sample_location_specify": null, "inhibition_adjust": "yes", "lod_ref": "www.example.com", "rec_eff_spike_conc": 2.37, "hum_frac_target_mic_ref": "www.example.com", "wwtp_jurisdiction": "CA", "inhibition_detect": "yes", "sample_type": "8-hr flow-weighted composite", "hum_frac_mic_conc": 12.002, "influent_equilibrated": "no", "ntc_amplify": "no", "rec_eff_target_name": "puro", "pcr_type": "qpcr", "pretreatment_specify": "chemical"}]
